CREATE TABLE memos (
  content text
);
CREATE INDEX pgrn_index ON memos USING PGroonga (content);
INSERT INTO memos VALUES ('Groonga is fast!');
SELECT pgroonga_set_writable(false);
 pgroonga_set_writable 
-----------------------
 t
(1 row)

UPDATE memos SET content = 'PGroonga is fast!';
ERROR:  pgroonga: can't insert a record while pgroonga.writable is false
SELECT * FROM memos;
     content      
------------------
 Groonga is fast!
(1 row)

SELECT pgroonga_command('select',
			ARRAY[
			  'table', pgroonga_table_name('pgrn_index'),
			  'output_columns', '_id, content'
			])::jsonb->>1;
                                    ?column?                                    
--------------------------------------------------------------------------------
 [[[1], [["_id", "UInt32"], ["content", "LongText"]], [1, "Groonga is fast!"]]]
(1 row)

SELECT pgroonga_set_writable(true);
 pgroonga_set_writable 
-----------------------
 f
(1 row)

UPDATE memos SET content = 'PGroonga is fast!';
SELECT * FROM memos;
      content      
-------------------
 PGroonga is fast!
(1 row)

SELECT pgroonga_command('select',
			ARRAY[
			  'table', pgroonga_table_name('pgrn_index'),
			  'output_columns', '_id, content'
			])::jsonb->>1;
                                                 ?column?                                                 
----------------------------------------------------------------------------------------------------------
 [[[2], [["_id", "UInt32"], ["content", "LongText"]], [1, "Groonga is fast!"], [2, "PGroonga is fast!"]]]
(1 row)

DROP TABLE memos;
